{
  "anchor_kind": "RFC3161_TSA",
  "anchor_time_utc_us": 1784000600000000,
  "anchored_digest": "fef5fa4fd0dd6a437cdf8b8d9ecafc0e5425295789e4681c1aa8c5c72e0f5022",
  "attempt_ledger_sha256": "fef5fa4fd0dd6a437cdf8b8d9ecafc0e5425295789e4681c1aa8c5c72e0f5022",
  "chain_id": "chain.s10.e2a.synthetic",
  "close_id": "anchor.close.s10.e2a.synthetic",
  "commitment_namespace": "lazyllm.s10.e2a.synthetic",
  "commitment_proof_path": "anchors/commitment_proof.json",
  "commitment_proof_sha256": "93a631ceaec9a9f3673f373d33e1d9f0f961d6e1dbcdd4066a16a3a77aecd3e5",
  "committed_plan_count": 1,
  "committed_plan_set_sha256": "8a2ea4028a0c9e2037248aee1bd6e273075f2e3f62927182727beab952ce0ebe",
  "enumeration_status": "COMPLETE",
  "experiment_identity": "s10.e2a.mechanics",
  "identity_binding_sha256": "b92ddb2dd5d46db5925e659722602f875de8440f0cfd7ca154b11124821bf899",
  "kind": "LedgerCloseReceipt",
  "ledger_head_sha256": "b542ec313a5f9b323e22968476d9a989a7f3599bacca6bf89a7467bd7d9bed0f",
  "log_checkpoint_sha256": "38318b73f67a75ba94f70442d94923b22d8fc44b7c4cfa3356bba318d7229162",
  "log_identity": "synthetic-log",
  "message_imprint_sha256": "fef5fa4fd0dd6a437cdf8b8d9ecafc0e5425295789e4681c1aa8c5c72e0f5022",
  "plan_anchor_id": "anchor.plan.s10.e2a.synthetic",
  "plan_anchor_record_sha256": "9893be90dce53f0d8f3d67969a2568e1be0f24657d41e7258f042082b28c1685",
  "provenance": "MEASURED",
  "reason_code": "SYNTHETIC_MECHANICS_FIXTURE",
  "record_sha256": "0e90a17254b51a9fe4a0c9e4750dcf1705d282214de9b10b94026bd573985da3",
  "schema_version": 4,
  "serial_number_hex": "0x0640067B",
  "set_id": "set.s10.e2a.synthetic",
  "status": "OK",
  "token_der_path": "anchors/close_token.der",
  "token_der_sha256": "d06b08bb4a24e3726934028f7ca72b4cafffd8c2b552fff62452af57a58bee7a",
  "token_hash_algorithm": "sha256",
  "trust_root_custodian": "THIRD_PARTY_CA",
  "trust_root_id": "synthetic-tsa-root",
  "trust_root_pin_location": "E2A_FROZEN_CONSTANT",
  "trust_root_sha256": "ec48c13f8b9731375ef99df73ca2b3016d6c14642c0938a63d97cf3d1e369299",
  "tsa_leaf_cert_sha256": "c5c30de6b1070fe438d239006b599af3980814c36fc6c714db36768ff2e59c19",
  "tsa_policy_oid": "1.2.3.4.1",
  "tsa_subject_dn": "CN=freetsa.org,O=Free TSA,C=DE",
  "verifier_kind": "OPENSSL_TS_VERIFY"
}
